{
  "identity": {
    "atlasProductId": "ram_corsair_cmsx32gx5m1a5600c48",
    "schemaVersion": "1.0",
    "productType": "ram",
    "recordRevision": 1,
    "createdAt": "2026-09-01T00:00:00Z",
    "updatedAt": "2026-09-01T00:00:00Z",
    "createdBy": "system:d002-fixture-certification",
    "updatedBy": "system:d002-fixture-certification",
    "brand": "Corsair",
    "manufacturer": "Corsair",
    "productFamily": "Vengeance",
    "series": null,
    "modelName": "Vengeance CMSX32GX5M1A5600C48",
    "manufacturerPartNumber": "CMSX32GX5M1A5600C48",
    "alternatePartNumbers": [],
    "gtin": null,
    "upc": null,
    "ean": null,
    "countryOfOrigin": null,
    "displayName": "Corsair Vengeance DDR5 32GB (1×32GB) 5600 MT/s",
    "slug": "corsair-vengeance-cmsx32gx5m1a5600c48"
  },
  "governance": {
    "publicationStatus": "PENDING",
    "lifecycleStatus": "DRAFT",
    "manufacturerStatus": "UNKNOWN",
    "engineeringValidationStatus": "PASS",
    "humanReviewRequired": true,
    "reviewedBy": null,
    "reviewedAt": null,
    "changeReason": "D-002 fixture candidate; production Atlas admission requires separate operator review.",
    "supersedesRevision": null,
    "archivalReason": null,
    "launchDate": null,
    "discontinuedDate": null,
    "replacementAtlasProductId": null,
    "predecessorAtlasProductId": null,
    "warranty": null
  },
  "provenance": {
    "fieldSources": {
      "identity.manufacturerPartNumber": [
        {
          "sourceId": "SRC-MFG-CORSAIR-CMSX32GX5M1A5600C48-D002",
          "sourceType": "MANUFACTURER_PRODUCT_PAGE",
          "sourceLocator": "https://www.corsair.com/es/es/p/memory/cmsx32gx5m1a5600c48/vengeance-ddr5-sodimm-32gb-1x32gb-ddr5-5600mts-cl48-cmsx32gx5m1a5600c48",
          "publisher": "Corsair",
          "publishedDate": null,
          "retrievedAt": "2026-09-01T00:00:00Z",
          "verifiedBy": "system:d002-fixture-certification",
          "verificationStatus": "VERIFIED",
          "notes": "Manufacturer-controlled identity and specification evidence carried forward from D-001/D-001A research."
        }
      ],
      "extension.data.classification": [
        {
          "sourceId": "SRC-MFG-CORSAIR-CMSX32GX5M1A5600C48-D002",
          "sourceType": "MANUFACTURER_PRODUCT_PAGE",
          "sourceLocator": "https://www.corsair.com/es/es/p/memory/cmsx32gx5m1a5600c48/vengeance-ddr5-sodimm-32gb-1x32gb-ddr5-5600mts-cl48-cmsx32gx5m1a5600c48",
          "publisher": "Corsair",
          "publishedDate": null,
          "retrievedAt": "2026-09-01T00:00:00Z",
          "verifiedBy": "system:d002-fixture-certification",
          "verificationStatus": "VERIFIED",
          "notes": "Manufacturer-controlled identity and specification evidence carried forward from D-001/D-001A research."
        }
      ],
      "extension.data.capacity": [
        {
          "sourceId": "SRC-MFG-CORSAIR-CMSX32GX5M1A5600C48-D002",
          "sourceType": "MANUFACTURER_PRODUCT_PAGE",
          "sourceLocator": "https://www.corsair.com/es/es/p/memory/cmsx32gx5m1a5600c48/vengeance-ddr5-sodimm-32gb-1x32gb-ddr5-5600mts-cl48-cmsx32gx5m1a5600c48",
          "publisher": "Corsair",
          "publishedDate": null,
          "retrievedAt": "2026-09-01T00:00:00Z",
          "verifiedBy": "system:d002-fixture-certification",
          "verificationStatus": "VERIFIED",
          "notes": "Manufacturer-controlled identity and specification evidence carried forward from D-001/D-001A research."
        }
      ],
      "extension.data.performance": [
        {
          "sourceId": "SRC-MFG-CORSAIR-CMSX32GX5M1A5600C48-D002",
          "sourceType": "MANUFACTURER_PRODUCT_PAGE",
          "sourceLocator": "https://www.corsair.com/es/es/p/memory/cmsx32gx5m1a5600c48/vengeance-ddr5-sodimm-32gb-1x32gb-ddr5-5600mts-cl48-cmsx32gx5m1a5600c48",
          "publisher": "Corsair",
          "publishedDate": null,
          "retrievedAt": "2026-09-01T00:00:00Z",
          "verifiedBy": "system:d002-fixture-certification",
          "verificationStatus": "VERIFIED",
          "notes": "Manufacturer-controlled identity and specification evidence carried forward from D-001/D-001A research."
        }
      ]
    }
  },
  "validation": {
    "errors": [],
    "warnings": [],
    "validatedAt": "2026-09-01T00:00:00Z",
    "validatorVersion": "atlas-product-validator/1.0.0+sentinel-ram/1.0.0"
  },
  "extension": {
    "extensionType": "ram",
    "schemaVersion": "1.0",
    "data": {
      "classification": {
        "memoryType": "DDR5",
        "formFactor": "SO_DIMM",
        "applicationClass": "LAPTOP",
        "moduleType": "SO_DIMM",
        "buffering": "UNBUFFERED",
        "eccType": "ON_DIE_ONLY",
        "isKit": false,
        "gamingPositioning": null,
        "workstationPositioning": false,
        "serverPositioning": false
      },
      "capacity": {
        "capacityGb": 32,
        "moduleCount": 1,
        "capacityPerModuleGb": 32,
        "rankConfiguration": "UNKNOWN",
        "chipDensityGb": null,
        "organization": null
      },
      "performance": {
        "dataRateMtps": 5600,
        "baseJedecDataRateMtps": null,
        "speedLabel": "DDR5-5600",
        "casLatency": 48,
        "tRcd": 48,
        "tRp": 48,
        "tRas": 90,
        "primaryTimings": "48-48-48-90",
        "xmpSupport": "UNKNOWN",
        "expoSupport": "UNKNOWN",
        "jedecProfiles": [],
        "overclockProfiles": [],
        "testedSpeedMtps": null,
        "testedLatencyCl": null,
        "bandwidthGbps": 44.8
      },
      "electrical": {
        "ratedVoltage": null,
        "baseVoltage": null,
        "pmicLocation": "UNKNOWN",
        "powerManagementNotes": null
      },
      "physical": {
        "heatSpreader": false,
        "heatSpreaderMaterial": null,
        "heightMm": null,
        "lengthMm": null,
        "widthMm": null,
        "color": null,
        "rgbLighting": false,
        "lightingEcosystem": [],
        "lowProfile": false,
        "moduleWeightGrams": null,
        "kitWeightGrams": null
      },
      "compatibility": {
        "platformCompatibility": [],
        "chipsetCompatibility": [],
        "cpuGenerationCompatibility": [],
        "qvlReferences": [],
        "requiresBiosSupport": null,
        "compatibilityNotes": null
      }
    }
  }
}
