{
  "identity": {
    "atlasProductId": "ram_crucial_ct32g56c46u5",
    "schemaVersion": "1.0",
    "productType": "ram",
    "recordRevision": 2,
    "createdAt": "2026-09-01T00:00:00Z",
    "updatedAt": "2026-09-08T05:58:28.556Z",
    "createdBy": "system:d002-fixture-certification",
    "updatedBy": "human:Clinton_Ramsook",
    "brand": "Crucial",
    "manufacturer": "Crucial",
    "productFamily": "Crucial",
    "series": null,
    "modelName": "Crucial CT32G56C46U5",
    "manufacturerPartNumber": "CT32G56C46U5",
    "alternatePartNumbers": [],
    "gtin": null,
    "upc": null,
    "ean": null,
    "countryOfOrigin": null,
    "displayName": "Crucial Crucial DDR5 32GB (1×32GB) 5600 MT/s",
    "slug": "crucial-crucial-ct32g56c46u5"
  },
  "governance": {
    "publicationStatus": "READY",
    "lifecycleStatus": "ACTIVE",
    "manufacturerStatus": "UNKNOWN",
    "engineeringValidationStatus": "PASS",
    "humanReviewRequired": false,
    "reviewedBy": "human:Clinton_Ramsook",
    "reviewedAt": "2026-09-08T05:58:28.556Z",
    "changeReason": "ATLAS-ACTIVATION-002 authorized pre-expansion RAM lifecycle review; no retail, acquisition, market, price, or publication authority implied.",
    "supersedesRevision": null,
    "archivalReason": null,
    "launchDate": null,
    "discontinuedDate": null,
    "replacementAtlasProductId": null,
    "predecessorAtlasProductId": null,
    "warranty": null
  },
  "provenance": {
    "fieldSources": {
      "identity.manufacturerPartNumber": [
        {
          "sourceId": "SRC-MFG-CRUCIAL-CT32G56C46U5-D002",
          "sourceType": "MANUFACTURER_PRODUCT_PAGE",
          "sourceLocator": "https://eu.crucial.com/memory/ddr5/ct32g56c46u5/ct24929039",
          "publisher": "Crucial",
          "publishedDate": null,
          "retrievedAt": "2026-09-01T00:00:00Z",
          "verifiedBy": "system:d002-fixture-certification",
          "verificationStatus": "VERIFIED",
          "notes": "Manufacturer-controlled identity and specification evidence carried forward from D-001/D-001A research."
        }
      ],
      "extension.data.classification": [
        {
          "sourceId": "SRC-MFG-CRUCIAL-CT32G56C46U5-D002",
          "sourceType": "MANUFACTURER_PRODUCT_PAGE",
          "sourceLocator": "https://eu.crucial.com/memory/ddr5/ct32g56c46u5/ct24929039",
          "publisher": "Crucial",
          "publishedDate": null,
          "retrievedAt": "2026-09-01T00:00:00Z",
          "verifiedBy": "system:d002-fixture-certification",
          "verificationStatus": "VERIFIED",
          "notes": "Manufacturer-controlled identity and specification evidence carried forward from D-001/D-001A research."
        }
      ],
      "extension.data.capacity": [
        {
          "sourceId": "SRC-MFG-CRUCIAL-CT32G56C46U5-D002",
          "sourceType": "MANUFACTURER_PRODUCT_PAGE",
          "sourceLocator": "https://eu.crucial.com/memory/ddr5/ct32g56c46u5/ct24929039",
          "publisher": "Crucial",
          "publishedDate": null,
          "retrievedAt": "2026-09-01T00:00:00Z",
          "verifiedBy": "system:d002-fixture-certification",
          "verificationStatus": "VERIFIED",
          "notes": "Manufacturer-controlled identity and specification evidence carried forward from D-001/D-001A research."
        }
      ],
      "extension.data.performance": [
        {
          "sourceId": "SRC-MFG-CRUCIAL-CT32G56C46U5-D002",
          "sourceType": "MANUFACTURER_PRODUCT_PAGE",
          "sourceLocator": "https://eu.crucial.com/memory/ddr5/ct32g56c46u5/ct24929039",
          "publisher": "Crucial",
          "publishedDate": null,
          "retrievedAt": "2026-09-01T00:00:00Z",
          "verifiedBy": "system:d002-fixture-certification",
          "verificationStatus": "VERIFIED",
          "notes": "Manufacturer-controlled identity and specification evidence carried forward from D-001/D-001A research."
        }
      ]
    }
  },
  "validation": {
    "errors": [],
    "warnings": [],
    "validatedAt": "2026-09-01T00:00:00Z",
    "validatorVersion": "atlas-product-validator/1.0.0+sentinel-ram/1.0.0"
  },
  "extension": {
    "extensionType": "ram",
    "schemaVersion": "1.0",
    "data": {
      "classification": {
        "memoryType": "DDR5",
        "formFactor": "DIMM",
        "applicationClass": "DESKTOP",
        "moduleType": "UDIMM",
        "buffering": "UNBUFFERED",
        "eccType": "ON_DIE_ONLY",
        "isKit": false,
        "gamingPositioning": null,
        "workstationPositioning": false,
        "serverPositioning": false
      },
      "capacity": {
        "capacityGb": 32,
        "moduleCount": 1,
        "capacityPerModuleGb": 32,
        "rankConfiguration": "UNKNOWN",
        "chipDensityGb": null,
        "organization": null
      },
      "performance": {
        "dataRateMtps": 5600,
        "baseJedecDataRateMtps": null,
        "speedLabel": "DDR5-5600",
        "casLatency": null,
        "tRcd": null,
        "tRp": null,
        "tRas": null,
        "primaryTimings": null,
        "xmpSupport": "UNKNOWN",
        "expoSupport": "UNKNOWN",
        "jedecProfiles": [],
        "overclockProfiles": [],
        "testedSpeedMtps": null,
        "testedLatencyCl": null,
        "bandwidthGbps": 44.8
      },
      "electrical": {
        "ratedVoltage": 1.1,
        "baseVoltage": null,
        "pmicLocation": "UNKNOWN",
        "powerManagementNotes": null
      },
      "physical": {
        "heatSpreader": false,
        "heatSpreaderMaterial": null,
        "heightMm": null,
        "lengthMm": null,
        "widthMm": null,
        "color": null,
        "rgbLighting": false,
        "lightingEcosystem": [],
        "lowProfile": false,
        "moduleWeightGrams": null,
        "kitWeightGrams": null
      },
      "compatibility": {
        "platformCompatibility": [],
        "chipsetCompatibility": [],
        "cpuGenerationCompatibility": [],
        "qvlReferences": [],
        "requiresBiosSupport": null,
        "compatibilityNotes": null
      }
    }
  }
}
