{
  "identity": {
    "atlasProductId": "ram_klevv_kd5agsa80_48g400d",
    "schemaVersion": "1.0",
    "productType": "ram",
    "recordRevision": 2,
    "createdAt": "2026-10-05T00:00:00.000Z",
    "updatedAt": "2026-10-05T00:00:00.000Z",
    "createdBy": "system:atlas-ram-manufacturer-first-cohort-admission-p1",
    "updatedBy": "human:Clinton_Ramsook",
    "brand": "KLEVV",
    "manufacturer": "Essencore Limited",
    "productFamily": "DDR5 SODIMM",
    "series": null,
    "modelName": "DDR5 SODIMM KD5AGSA80-48G400D",
    "manufacturerPartNumber": "KD5AGSA80-48G400D",
    "alternatePartNumbers": [],
    "gtin": null,
    "upc": null,
    "ean": null,
    "countryOfOrigin": null,
    "displayName": "KLEVV DDR5 SODIMM 32GB (2×16GB) 4800 MT/s",
    "slug": "klevv-kd5agsa80-48g400d"
  },
  "governance": {
    "publicationStatus": "READY",
    "lifecycleStatus": "ACTIVE",
    "manufacturerStatus": "CURRENT",
    "engineeringValidationStatus": "PASS",
    "humanReviewRequired": false,
    "reviewedBy": "human:Clinton_Ramsook",
    "reviewedAt": "2026-10-05T00:00:00.000Z",
    "changeReason": "ATLAS_RAM_MANUFACTURER_FIRST_COHORT_LIFECYCLE_REVIEW_AND_ACTIVATION_P1 operator-approved lifecycle review; no retailer, market, destination, publication, or release authority implied.",
    "supersedesRevision": null,
    "archivalReason": null,
    "launchDate": null,
    "discontinuedDate": null,
    "replacementAtlasProductId": null,
    "predecessorAtlasProductId": null,
    "warranty": null
  },
  "provenance": {
    "fieldSources": {
      "identity.manufacturerPartNumber": [
        {
          "sourceId": "SRC-MFG-KLEVV-KD5AGSA80_48G400D-AMFCA",
          "sourceType": "MANUFACTURER_PRODUCT_PAGE",
          "sourceLocator": "https://www.klevv.com/ktw/products_details/memory/D5_SODIMM.php",
          "publisher": "KLEVV",
          "publishedDate": null,
          "retrievedAt": "2026-10-05T00:00:00.000Z",
          "verifiedBy": "system:atlas-ram-manufacturer-first-cohort-admission-p1",
          "verificationStatus": "VERIFIED",
          "notes": "Exact manufacturer MPN and canonical RAM specification verified from first-party material; retailer identity is separate and is not product-truth authority."
        }
      ],
      "identity.productFamily": [
        {
          "sourceId": "SRC-MFG-KLEVV-KD5AGSA80_48G400D-AMFCA",
          "sourceType": "MANUFACTURER_PRODUCT_PAGE",
          "sourceLocator": "https://www.klevv.com/ktw/products_details/memory/D5_SODIMM.php",
          "publisher": "KLEVV",
          "publishedDate": null,
          "retrievedAt": "2026-10-05T00:00:00.000Z",
          "verifiedBy": "system:atlas-ram-manufacturer-first-cohort-admission-p1",
          "verificationStatus": "VERIFIED",
          "notes": "Exact manufacturer MPN and canonical RAM specification verified from first-party material; retailer identity is separate and is not product-truth authority."
        }
      ],
      "extension.data.classification": [
        {
          "sourceId": "SRC-MFG-KLEVV-KD5AGSA80_48G400D-AMFCA",
          "sourceType": "MANUFACTURER_PRODUCT_PAGE",
          "sourceLocator": "https://www.klevv.com/ktw/products_details/memory/D5_SODIMM.php",
          "publisher": "KLEVV",
          "publishedDate": null,
          "retrievedAt": "2026-10-05T00:00:00.000Z",
          "verifiedBy": "system:atlas-ram-manufacturer-first-cohort-admission-p1",
          "verificationStatus": "VERIFIED",
          "notes": "Exact manufacturer MPN and canonical RAM specification verified from first-party material; retailer identity is separate and is not product-truth authority."
        }
      ],
      "extension.data.capacity": [
        {
          "sourceId": "SRC-MFG-KLEVV-KD5AGSA80_48G400D-AMFCA",
          "sourceType": "MANUFACTURER_PRODUCT_PAGE",
          "sourceLocator": "https://www.klevv.com/ktw/products_details/memory/D5_SODIMM.php",
          "publisher": "KLEVV",
          "publishedDate": null,
          "retrievedAt": "2026-10-05T00:00:00.000Z",
          "verifiedBy": "system:atlas-ram-manufacturer-first-cohort-admission-p1",
          "verificationStatus": "VERIFIED",
          "notes": "Exact manufacturer MPN and canonical RAM specification verified from first-party material; retailer identity is separate and is not product-truth authority."
        }
      ],
      "extension.data.performance": [
        {
          "sourceId": "SRC-MFG-KLEVV-KD5AGSA80_48G400D-AMFCA",
          "sourceType": "MANUFACTURER_PRODUCT_PAGE",
          "sourceLocator": "https://www.klevv.com/ktw/products_details/memory/D5_SODIMM.php",
          "publisher": "KLEVV",
          "publishedDate": null,
          "retrievedAt": "2026-10-05T00:00:00.000Z",
          "verifiedBy": "system:atlas-ram-manufacturer-first-cohort-admission-p1",
          "verificationStatus": "VERIFIED",
          "notes": "Exact manufacturer MPN and canonical RAM specification verified from first-party material; retailer identity is separate and is not product-truth authority."
        }
      ],
      "extension.data.electrical": [
        {
          "sourceId": "SRC-MFG-KLEVV-KD5AGSA80_48G400D-AMFCA",
          "sourceType": "MANUFACTURER_PRODUCT_PAGE",
          "sourceLocator": "https://www.klevv.com/ktw/products_details/memory/D5_SODIMM.php",
          "publisher": "KLEVV",
          "publishedDate": null,
          "retrievedAt": "2026-10-05T00:00:00.000Z",
          "verifiedBy": "system:atlas-ram-manufacturer-first-cohort-admission-p1",
          "verificationStatus": "VERIFIED",
          "notes": "Exact manufacturer MPN and canonical RAM specification verified from first-party material; retailer identity is separate and is not product-truth authority."
        }
      ]
    }
  },
  "validation": {
    "errors": [],
    "warnings": [],
    "validatedAt": "2026-10-05T00:00:00.000Z",
    "validatorVersion": "atlas-product-validator/1.0.0+sentinel-ram/1.0.0"
  },
  "extension": {
    "extensionType": "ram",
    "schemaVersion": "1.0",
    "data": {
      "classification": {
        "memoryType": "DDR5",
        "formFactor": "SO_DIMM",
        "applicationClass": "LAPTOP",
        "moduleType": "SO_DIMM",
        "buffering": "UNBUFFERED",
        "eccType": "ON_DIE_ONLY",
        "isKit": true,
        "gamingPositioning": false,
        "workstationPositioning": false,
        "serverPositioning": false
      },
      "capacity": {
        "capacityGb": 32,
        "moduleCount": 2,
        "capacityPerModuleGb": 16,
        "rankConfiguration": "UNKNOWN",
        "chipDensityGb": null,
        "organization": null
      },
      "performance": {
        "dataRateMtps": 4800,
        "baseJedecDataRateMtps": 4800,
        "speedLabel": "DDR5-4800",
        "casLatency": null,
        "tRcd": null,
        "tRp": null,
        "tRas": null,
        "primaryTimings": null,
        "xmpSupport": "UNKNOWN",
        "expoSupport": "UNKNOWN",
        "jedecProfiles": [],
        "overclockProfiles": [],
        "testedSpeedMtps": null,
        "testedLatencyCl": null,
        "bandwidthGbps": 38.4
      },
      "electrical": {
        "ratedVoltage": 1.1,
        "baseVoltage": 1.1,
        "pmicLocation": "ON_MODULE",
        "powerManagementNotes": null
      },
      "physical": {
        "heatSpreader": false,
        "heatSpreaderMaterial": null,
        "heightMm": null,
        "lengthMm": null,
        "widthMm": null,
        "color": null,
        "rgbLighting": false,
        "lightingEcosystem": [],
        "lowProfile": null,
        "moduleWeightGrams": null,
        "kitWeightGrams": null
      },
      "compatibility": {
        "platformCompatibility": [],
        "chipsetCompatibility": [],
        "cpuGenerationCompatibility": [],
        "qvlReferences": [],
        "requiresBiosSupport": null,
        "compatibilityNotes": null
      }
    }
  }
}
