{
  "identity": {
    "atlasProductId": "ram_kingston_kf572c38rsk2_32",
    "schemaVersion": "1.0",
    "productType": "ram",
    "recordRevision": 1,
    "createdAt": "2026-09-01T00:00:00Z",
    "updatedAt": "2026-09-01T00:00:00Z",
    "createdBy": "system:d002-fixture-certification",
    "updatedBy": "system:d002-fixture-certification",
    "brand": "Kingston",
    "manufacturer": "Kingston",
    "productFamily": "FURY Renegade",
    "series": null,
    "modelName": "FURY Renegade KF572C38RSK2-32",
    "manufacturerPartNumber": "KF572C38RSK2-32",
    "alternatePartNumbers": [],
    "gtin": null,
    "upc": null,
    "ean": null,
    "countryOfOrigin": null,
    "displayName": "Kingston FURY Renegade DDR5 32GB (2×16GB) 7200 MT/s",
    "slug": "kingston-fury-renegade-kf572c38rsk2-32"
  },
  "governance": {
    "publicationStatus": "PENDING",
    "lifecycleStatus": "DRAFT",
    "manufacturerStatus": "UNKNOWN",
    "engineeringValidationStatus": "PASS",
    "humanReviewRequired": true,
    "reviewedBy": null,
    "reviewedAt": null,
    "changeReason": "D-002 fixture candidate; production Atlas admission requires separate operator review.",
    "supersedesRevision": null,
    "archivalReason": null,
    "launchDate": null,
    "discontinuedDate": null,
    "replacementAtlasProductId": null,
    "predecessorAtlasProductId": null,
    "warranty": null
  },
  "provenance": {
    "fieldSources": {
      "identity.manufacturerPartNumber": [
        {
          "sourceId": "SRC-MFG-KINGSTON-KF572C38RSK2-32-D002",
          "sourceType": "MANUFACTURER_DATASHEET",
          "sourceLocator": "https://www.kingston.com/datasheets/KF572C38RSK2-32.pdf",
          "publisher": "Kingston",
          "publishedDate": null,
          "retrievedAt": "2026-09-01T00:00:00Z",
          "verifiedBy": "system:d002-fixture-certification",
          "verificationStatus": "VERIFIED",
          "notes": "Manufacturer-controlled identity and specification evidence carried forward from D-001/D-001A research."
        }
      ],
      "extension.data.classification": [
        {
          "sourceId": "SRC-MFG-KINGSTON-KF572C38RSK2-32-D002",
          "sourceType": "MANUFACTURER_DATASHEET",
          "sourceLocator": "https://www.kingston.com/datasheets/KF572C38RSK2-32.pdf",
          "publisher": "Kingston",
          "publishedDate": null,
          "retrievedAt": "2026-09-01T00:00:00Z",
          "verifiedBy": "system:d002-fixture-certification",
          "verificationStatus": "VERIFIED",
          "notes": "Manufacturer-controlled identity and specification evidence carried forward from D-001/D-001A research."
        }
      ],
      "extension.data.capacity": [
        {
          "sourceId": "SRC-MFG-KINGSTON-KF572C38RSK2-32-D002",
          "sourceType": "MANUFACTURER_DATASHEET",
          "sourceLocator": "https://www.kingston.com/datasheets/KF572C38RSK2-32.pdf",
          "publisher": "Kingston",
          "publishedDate": null,
          "retrievedAt": "2026-09-01T00:00:00Z",
          "verifiedBy": "system:d002-fixture-certification",
          "verificationStatus": "VERIFIED",
          "notes": "Manufacturer-controlled identity and specification evidence carried forward from D-001/D-001A research."
        }
      ],
      "extension.data.performance": [
        {
          "sourceId": "SRC-MFG-KINGSTON-KF572C38RSK2-32-D002",
          "sourceType": "MANUFACTURER_DATASHEET",
          "sourceLocator": "https://www.kingston.com/datasheets/KF572C38RSK2-32.pdf",
          "publisher": "Kingston",
          "publishedDate": null,
          "retrievedAt": "2026-09-01T00:00:00Z",
          "verifiedBy": "system:d002-fixture-certification",
          "verificationStatus": "VERIFIED",
          "notes": "Manufacturer-controlled identity and specification evidence carried forward from D-001/D-001A research."
        }
      ]
    }
  },
  "validation": {
    "errors": [],
    "warnings": [],
    "validatedAt": "2026-09-01T00:00:00Z",
    "validatorVersion": "atlas-product-validator/1.0.0+sentinel-ram/1.0.0"
  },
  "extension": {
    "extensionType": "ram",
    "schemaVersion": "1.0",
    "data": {
      "classification": {
        "memoryType": "DDR5",
        "formFactor": "DIMM",
        "applicationClass": "DESKTOP",
        "moduleType": "UDIMM",
        "buffering": "UNBUFFERED",
        "eccType": "ON_DIE_ONLY",
        "isKit": true,
        "gamingPositioning": null,
        "workstationPositioning": false,
        "serverPositioning": false
      },
      "capacity": {
        "capacityGb": 32,
        "moduleCount": 2,
        "capacityPerModuleGb": 16,
        "rankConfiguration": "UNKNOWN",
        "chipDensityGb": null,
        "organization": null
      },
      "performance": {
        "dataRateMtps": 7200,
        "baseJedecDataRateMtps": null,
        "speedLabel": "DDR5-7200",
        "casLatency": null,
        "tRcd": null,
        "tRp": null,
        "tRas": null,
        "primaryTimings": null,
        "xmpSupport": "PROFILE_INCLUDED",
        "expoSupport": "UNKNOWN",
        "jedecProfiles": [],
        "overclockProfiles": [],
        "testedSpeedMtps": null,
        "testedLatencyCl": null,
        "bandwidthGbps": 57.6
      },
      "electrical": {
        "ratedVoltage": 1.45,
        "baseVoltage": null,
        "pmicLocation": "UNKNOWN",
        "powerManagementNotes": null
      },
      "physical": {
        "heatSpreader": true,
        "heatSpreaderMaterial": null,
        "heightMm": null,
        "lengthMm": null,
        "widthMm": null,
        "color": null,
        "rgbLighting": false,
        "lightingEcosystem": [],
        "lowProfile": false,
        "moduleWeightGrams": null,
        "kitWeightGrams": null
      },
      "compatibility": {
        "platformCompatibility": [],
        "chipsetCompatibility": [],
        "cpuGenerationCompatibility": [],
        "qvlReferences": [],
        "requiresBiosSupport": null,
        "compatibilityNotes": null
      }
    }
  }
}
